{
  "format": "aso-live-fixture/v1",
  "case_contract_version": "aso-vnext-eval-contract/v1",
  "target_package_version": "0.3.1",
  "target_runtime_fingerprint": "0f26d4eef92364de5c07f29713da1e20351227979e91d84753d469141177bc3d",
  "execution_status": "specified-not-run",
  "case_id": "ASO-L004",
  "purpose": "Prove explicit discovery-to-advice-to-execution transition.",
  "workspace": "disposable-temporary-directory",
  "pre_state": {
    "evidence_partitions": [
      "source-a",
      "source-b"
    ],
    "decision_options": [
      "option-1",
      "option-2"
    ],
    "artifact": "decision.txt"
  },
  "steps": [
    "assemble blind discovery",
    "accept and reconcile evidence",
    "release discovery responsibilities",
    "enlist or chain advisory integration",
    "compile controlled single-writer execution",
    "verify artifact"
  ],
  "injection": {
    "event": "accepted evidence removes option-2",
    "expected_recovery": "transition without preserving obsolete contribution or private scratch as truth"
  },
  "oracle": [
    "transition trigger and state dispositions recorded",
    "valid kernel regime per phase",
    "no orphaned worker",
    "one artifact writer"
  ],
  "forbidden_targets": [
    "canonical",
    "release",
    "plugins",
    "verification/evidence"
  ]
}
