{
  "format": "aso-live-fixture/v1",
  "case_contract_version": "aso-vnext-eval-contract/v1",
  "target_package_version": "0.3.1",
  "target_runtime_fingerprint": "0f26d4eef92364de5c07f29713da1e20351227979e91d84753d469141177bc3d",
  "execution_status": "specified-not-run",
  "case_id": "ASO-L006",
  "purpose": "Prove mixed-status closure at an earned evidence boundary.",
  "workspace": "disposable-temporary-directory",
  "pre_state": {
    "members": [
      {
        "id": "a",
        "status": "returned"
      },
      {
        "id": "b",
        "status": "failed"
      },
      {
        "id": "c",
        "status": "interrupted"
      }
    ],
    "artifact": "result.txt",
    "unsupported_claim": "live service is healthy"
  },
  "steps": [
    "reconcile returned evidence and artifact bytes",
    "record failed and interrupted dispositions",
    "keep health claim unverified",
    "release all responsibilities",
    "close without a fresh plan"
  ],
  "injection": {
    "event": "one return claims health without live observation",
    "expected_recovery": "preserve unverified boundary"
  },
  "oracle": [
    "every member disposition recorded",
    "artifact state reconciled",
    "health remains unverified",
    "organization dissolved"
  ],
  "forbidden_targets": [
    "canonical",
    "release",
    "plugins",
    "verification/evidence"
  ]
}
